{
  "schema_version": "1.0",
  "pack_id": "pack-20260806041631466236-ac040845",
  "profile": "content",
  "generated_at": "2026-08-06T16:55:59+00:00",
  "progression": "source-order",
  "nodes": [
    {
      "id": "concept-93807e8f0e3fdca1",
      "title": "90 分钟一口气搞懂人工智能和神经网络",
      "kind": "source-concept",
      "order": 0,
      "prerequisites": [],
      "source_locators": [
        "courses/ai-neural-networks-90min/FEISHU_COURSE.md#L3"
      ],
      "objectives": [
        "能够用自己的话解释“90 分钟一口气搞懂人工智能和神经网络”",
        "能够指出其适用条件、反例或证据边界"
      ],
      "mastery_checks": [
        "不看原文复述核心机制",
        "在一个新场景中正确应用",
        "说明至少一个不应使用的场景"
      ]
    },
    {
      "id": "concept-ea890e1357810201",
      "title": "课程目标",
      "kind": "source-concept",
      "order": 1,
      "prerequisites": [
        "concept-93807e8f0e3fdca1"
      ],
      "source_locators": [
        "courses/ai-neural-networks-90min/FEISHU_COURSE.md#L12"
      ],
      "objectives": [
        "能够用自己的话解释“课程目标”",
        "能够指出其适用条件、反例或证据边界"
      ],
      "mastery_checks": [
        "不看原文复述核心机制",
        "在一个新场景中正确应用",
        "说明至少一个不应使用的场景"
      ]
    },
    {
      "id": "concept-2e2ffca36f79e075",
      "title": "原片学习地图",
      "kind": "source-concept",
      "order": 2,
      "prerequisites": [
        "concept-ea890e1357810201"
      ],
      "source_locators": [
        "courses/ai-neural-networks-90min/FEISHU_COURSE.md#L26"
      ],
      "objectives": [
        "能够用自己的话解释“原片学习地图”",
        "能够指出其适用条件、反例或证据边界"
      ],
      "mastery_checks": [
        "不看原文复述核心机制",
        "在一个新场景中正确应用",
        "说明至少一个不应使用的场景"
      ]
    },
    {
      "id": "concept-8060bd86c07e9d1f",
      "title": "第 1 章 从达特茅斯会议开始",
      "kind": "source-concept",
      "order": 3,
      "prerequisites": [
        "concept-2e2ffca36f79e075"
      ],
      "source_locators": [
        "courses/ai-neural-networks-90min/FEISHU_COURSE.md#L54"
      ],
      "objectives": [
        "能够用自己的话解释“第 1 章 从达特茅斯会议开始”",
        "能够指出其适用条件、反例或证据边界"
      ],
      "mastery_checks": [
        "不看原文复述核心机制",
        "在一个新场景中正确应用",
        "说明至少一个不应使用的场景"
      ]
    },
    {
      "id": "concept-3d2f674dd0d7d245",
      "title": "检查点",
      "kind": "source-concept",
      "order": 4,
      "prerequisites": [
        "concept-8060bd86c07e9d1f"
      ],
      "source_locators": [
        "courses/ai-neural-networks-90min/FEISHU_COURSE.md#L68"
      ],
      "objectives": [
        "能够用自己的话解释“检查点”",
        "能够指出其适用条件、反例或证据边界"
      ],
      "mastery_checks": [
        "不看原文复述核心机制",
        "在一个新场景中正确应用",
        "说明至少一个不应使用的场景"
      ]
    },
    {
      "id": "concept-40d973bdd08ec61b",
      "title": "第 2 章 智能是输入到输出的函数",
      "kind": "source-concept",
      "order": 5,
      "prerequisites": [
        "concept-3d2f674dd0d7d245"
      ],
      "source_locators": [
        "courses/ai-neural-networks-90min/FEISHU_COURSE.md#L76"
      ],
      "objectives": [
        "能够用自己的话解释“第 2 章 智能是输入到输出的函数”",
        "能够指出其适用条件、反例或证据边界"
      ],
      "mastery_checks": [
        "不看原文复述核心机制",
        "在一个新场景中正确应用",
        "说明至少一个不应使用的场景"
      ]
    },
    {
      "id": "concept-f6c348d143018c37",
      "title": "图灵测试在这条路线中的位置",
      "kind": "source-concept",
      "order": 6,
      "prerequisites": [
        "concept-40d973bdd08ec61b"
      ],
      "source_locators": [
        "courses/ai-neural-networks-90min/FEISHU_COURSE.md#L110"
      ],
      "objectives": [
        "能够用自己的话解释“图灵测试在这条路线中的位置”",
        "能够指出其适用条件、反例或证据边界"
      ],
      "mastery_checks": [
        "不看原文复述核心机制",
        "在一个新场景中正确应用",
        "说明至少一个不应使用的场景"
      ]
    },
    {
      "id": "concept-f03e598c2040a744",
      "title": "本章结论",
      "kind": "source-concept",
      "order": 7,
      "prerequisites": [
        "concept-f6c348d143018c37"
      ],
      "source_locators": [
        "courses/ai-neural-networks-90min/FEISHU_COURSE.md#L114"
      ],
      "objectives": [
        "能够用自己的话解释“本章结论”",
        "能够指出其适用条件、反例或证据边界"
      ],
      "mastery_checks": [
        "不看原文复述核心机制",
        "在一个新场景中正确应用",
        "说明至少一个不应使用的场景"
      ]
    },
    {
      "id": "concept-1d9702e464af448b",
      "title": "第 3 章 符号主义：把知识写成规则",
      "kind": "source-concept",
      "order": 8,
      "prerequisites": [
        "concept-f03e598c2040a744"
      ],
      "source_locators": [
        "courses/ai-neural-networks-90min/FEISHU_COURSE.md#L128"
      ],
      "objectives": [
        "能够用自己的话解释“第 3 章 符号主义：把知识写成规则”",
        "能够指出其适用条件、反例或证据边界"
      ],
      "mastery_checks": [
        "不看原文复述核心机制",
        "在一个新场景中正确应用",
        "说明至少一个不应使用的场景"
      ]
    },
    {
      "id": "concept-bccaa725cf2c9cdc",
      "title": "为什么专家系统遇到瓶颈",
      "kind": "source-concept",
      "order": 9,
      "prerequisites": [
        "concept-1d9702e464af448b"
      ],
      "source_locators": [
        "courses/ai-neural-networks-90min/FEISHU_COURSE.md#L150"
      ],
      "objectives": [
        "能够用自己的话解释“为什么专家系统遇到瓶颈”",
        "能够指出其适用条件、反例或证据边界"
      ],
      "mastery_checks": [
        "不看原文复述核心机制",
        "在一个新场景中正确应用",
        "说明至少一个不应使用的场景"
      ]
    },
    {
      "id": "concept-d3dc1abdfc33c2ce",
      "title": "第 4 章 机器学习：不要把答案写死，让机器自己改",
      "kind": "source-concept",
      "order": 10,
      "prerequisites": [
        "concept-bccaa725cf2c9cdc"
      ],
      "source_locators": [
        "courses/ai-neural-networks-90min/FEISHU_COURSE.md#L167"
      ],
      "objectives": [
        "能够用自己的话解释“第 4 章 机器学习：不要把答案写死，让机器自己改”",
        "能够指出其适用条件、反例或证据边界"
      ],
      "mastery_checks": [
        "不看原文复述核心机制",
        "在一个新场景中正确应用",
        "说明至少一个不应使用的场景"
      ]
    },
    {
      "id": "concept-ba0f50ac4259d7ff",
      "title": "第 5 章 联结主义与感知机",
      "kind": "source-concept",
      "order": 11,
      "prerequisites": [
        "concept-d3dc1abdfc33c2ce"
      ],
      "source_locators": [
        "courses/ai-neural-networks-90min/FEISHU_COURSE.md#L207"
      ],
      "objectives": [
        "能够用自己的话解释“第 5 章 联结主义与感知机”",
        "能够指出其适用条件、反例或证据边界"
      ],
      "mastery_checks": [
        "不看原文复述核心机制",
        "在一个新场景中正确应用",
        "说明至少一个不应使用的场景"
      ]
    },
    {
      "id": "concept-c59a627ad85bc327",
      "title": "5.1 用特征识别苹果",
      "kind": "source-concept",
      "order": 12,
      "prerequisites": [
        "concept-ba0f50ac4259d7ff"
      ],
      "source_locators": [
        "courses/ai-neural-networks-90min/FEISHU_COURSE.md#L213"
      ],
      "objectives": [
        "能够用自己的话解释“5.1 用特征识别苹果”",
        "能够指出其适用条件、反例或证据边界"
      ],
      "mastery_checks": [
        "不看原文复述核心机制",
        "在一个新场景中正确应用",
        "说明至少一个不应使用的场景"
      ]
    },
    {
      "id": "concept-8e2dc754e2e9f08c",
      "title": "5.2 这就是感知机",
      "kind": "source-concept",
      "order": 13,
      "prerequisites": [
        "concept-c59a627ad85bc327"
      ],
      "source_locators": [
        "courses/ai-neural-networks-90min/FEISHU_COURSE.md#L243"
      ],
      "objectives": [
        "能够用自己的话解释“5.2 这就是感知机”",
        "能够指出其适用条件、反例或证据边界"
      ],
      "mastery_checks": [
        "不看原文复述核心机制",
        "在一个新场景中正确应用",
        "说明至少一个不应使用的场景"
      ]
    },
    {
      "id": "concept-e2f44312b5298077",
      "title": "5.3 为什么早期感知机会引发轰动",
      "kind": "source-concept",
      "order": 14,
      "prerequisites": [
        "concept-8e2dc754e2e9f08c"
      ],
      "source_locators": [
        "courses/ai-neural-networks-90min/FEISHU_COURSE.md#L255"
      ],
      "objectives": [
        "能够用自己的话解释“5.3 为什么早期感知机会引发轰动”",
        "能够指出其适用条件、反例或证据边界"
      ],
      "mastery_checks": [
        "不看原文复述核心机制",
        "在一个新场景中正确应用",
        "说明至少一个不应使用的场景"
      ]
    },
    {
      "id": "concept-a2724bd8a4b32472",
      "title": "第 6 章 XOR：单层感知机的天花板",
      "kind": "source-concept",
      "order": 15,
      "prerequisites": [
        "concept-e2f44312b5298077"
      ],
      "source_locators": [
        "courses/ai-neural-networks-90min/FEISHU_COURSE.md#L271"
      ],
      "objectives": [
        "能够用自己的话解释“第 6 章 XOR：单层感知机的天花板”",
        "能够指出其适用条件、反例或证据边界"
      ],
      "mastery_checks": [
        "不看原文复述核心机制",
        "在一个新场景中正确应用",
        "说明至少一个不应使用的场景"
      ]
    },
    {
      "id": "concept-3b82372ea13d7eeb",
      "title": "不要从失败案例推出错误结论",
      "kind": "source-concept",
      "order": 16,
      "prerequisites": [
        "concept-a2724bd8a4b32472"
      ],
      "source_locators": [
        "courses/ai-neural-networks-90min/FEISHU_COURSE.md#L300"
      ],
      "objectives": [
        "能够用自己的话解释“不要从失败案例推出错误结论”",
        "能够指出其适用条件、反例或证据边界"
      ],
      "mastery_checks": [
        "不看原文复述核心机制",
        "在一个新场景中正确应用",
        "说明至少一个不应使用的场景"
      ]
    },
    {
      "id": "concept-d3e44fcb633e2302",
      "title": "第 7 章 多层感知机：组合带来非线性",
      "kind": "source-concept",
      "order": 17,
      "prerequisites": [
        "concept-3b82372ea13d7eeb"
      ],
      "source_locators": [
        "courses/ai-neural-networks-90min/FEISHU_COURSE.md#L312"
      ],
      "objectives": [
        "能够用自己的话解释“第 7 章 多层感知机：组合带来非线性”",
        "能够指出其适用条件、反例或证据边界"
      ],
      "mastery_checks": [
        "不看原文复述核心机制",
        "在一个新场景中正确应用",
        "说明至少一个不应使用的场景"
      ]
    },
    {
      "id": "concept-7eca150c28697ada",
      "title": "7.1 层级特征",
      "kind": "source-concept",
      "order": 18,
      "prerequisites": [
        "concept-d3e44fcb633e2302"
      ],
      "source_locators": [
        "courses/ai-neural-networks-90min/FEISHU_COURSE.md#L341"
      ],
      "objectives": [
        "能够用自己的话解释“7.1 层级特征”",
        "能够指出其适用条件、反例或证据边界"
      ],
      "mastery_checks": [
        "不看原文复述核心机制",
        "在一个新场景中正确应用",
        "说明至少一个不应使用的场景"
      ]
    },
    {
      "id": "concept-e2f87e0e05bb68d8",
      "title": "7.2 从 MLP 到现代架构",
      "kind": "source-concept",
      "order": 19,
      "prerequisites": [
        "concept-7eca150c28697ada"
      ],
      "source_locators": [